i am on aac then ya dumb fuck,H
which one is missing i thought their were in jls,none
beast dude s gonna be a hell of a defenseman him and mcbain are going to be a real solid pairing for the canes they are gonna be pretty good in a few years they got a lot of young talent,none
how could someone named emmit smith be racist,L
what a pathetic little man you are,L
you flatter him needlessly,none
back off hater z just leave them alone cuz its none of your bussiness bitches just ignore them olsen,none
yo this shits raw reminds me of the number playaz their song haters goes hard now that s a crew i can fuck with check out their song and fuck the haters haters,none
the fucking website said it worked for a devices only now i am in do not have shsh blobs just learned about those ifaith doesn t recognize my ios and i have two different redsn w versions that now do not mean shit it is great that you guys work so hard but please check your posts,none
ohh so you are a w bengal commie then are you no wonder you talk like such a sick nut you people are at war with reality and even lefty mamta is a sanghi to you pathetic haha no wonder you fear a pro development guy like modi,L
holy shit i did not realize that,none
no he did he told me and that is a fact that is how fucking stupid this asshole is,none
when you get a officer needs help call you put your donuts down and you help you do not wait to finish like a normal call,none
you liberal socialist communist democrats better understand what you are wishing for if you really believe what you say you believe why do not you just move to russia or some other communist country and enjoy the ride there,L
come on gets some pitches from him need that philly pen,none
she would do anything for her little girl u bastered u dont kno shit,none
phil you ignorant impolite rude slut go f k yourself exercising freedom of expression which you apparent y are against unless it concurs with your outdated view of the world,M
thought there was another race for a minute there,M
are you proud of your trolls,none
flagged you are a real dick,L
bethany catch some of those flying ants put them in a baggie and look up termites on the internet then talk to your building super because i think that what you have are swarming termites i say that because a lot of people have your experience and they almost all think that they are flying ants they aren t they are termites you should catch a few and compare them to what you find on the internet,none
jing i love this card your coloring is spectacular gorgeous white on white card,none
godwhacker you are commenting using pure stereotypes and ignorance first of all obama has surged thousand of troops into afghanistan killed us citizens without a trial and passed a law that would allow indefinite detention of us citizens sounds like perpetual war to me second of all ron paul is for bringing all our troops home and closing all our foreign bases so when you say he voted for perpetual war your not looking at his legislative record ron paul is known as the most anti war politician of either party so next time you decide to write a comment do some reading before you put your foot in your mouth because you have made yourself into a completely ignorant as uninformed people like yourself is the reason this country is such a mess you do not have the slightest idea of what you are saying i ask when will this wave of perpetual idiocy of voters who have the memory of a two year old and vote based on the latest campaign speeches and smears without checking a candidates legislative record,none
liberals do not want military intervention you buffoon,none
just a thought about those unwinnable illegal wars if they were illegal would not you think bush and cheney would have charges brought up on them by now fact is they were on the level its just another example of the liberal media getting all you liberals wound up tighter than dick s hatband just like little wind up toys get you started and away you go it s time to start thinking about impeachment of the dope head in chief,L
conservative scum bag retort to any criticism of grifter queen bitch waa they are reporting on stuff evil libruls are you tina tampa you must be,M
we are crap you said it yourself,none
please do not you are an idiot,L
och alla barn r lika och fungerar p precis samma s tt och alla saknar grundl ggande konsekvenst nkande eh om barn ges r str tt b r man rimligtvis antaga att merparten inte kommer utnyttja denna precis som hos den vuxna befolkningen,none
shut up faggot face faggot lol,none
romney steps in it with gay marriage line via buzzfeed which missed something of an attack angle from the right in this short romney riff on gay marriage romney says he wanted to stop the gay marriage ruling so it did not go across the country too bad he was not thinking that way when he implemented the model for obamacare at the state level as romneycare huh or was he video of romney embedded v rfpn uwm a dan riehl,none
who cares now that we now that the gs is coming out fuck the evo,L
poor baby you did not get your extreme santorum ron paul or any of the other losers vote for obama punk you are a bitter coney island whitefish that never had a chance to be used you are worthless and a pintless ideologue bigot your sentiment of vitriol comes at know surprise you must have given a a bunch of money away poor baby literally punk,none
pelosi is one of many who is standing behind the most criminal obummer but if they stood really close together you could not tell them apart they both along with holder and all the rest of em are outstandingly extremely deadly they all look like death warmed over but do not trust any of them they look dead because they are dead but they are the dead that can kill you if you are not careful i hope there will be some good news soon i am sick of this whole damn mess and more so i am hoping that we the people will have learned the lessons we are being taught on horrible government from the horrible governmental places where the dumb are in those schools of law all the way to the white house,none
thats right negro run off the site because you are no match for me anyway only pu to the c like you is no match for me,none
shut up you pawb lebron lsoing is not going to ad years to your life,none
yeah you remember that support they gave wisconsin once they figured out it was a losing bet obama and uncle joe have your back as long ass you win otherwise you are of no use to them now that is leadership you can believe in,none
and barry tries to convince us he is switched to christianity we re not all as stupid as he looks,none
what are you guys smoking,H
dodger radio playing tunes of fuck you at end of commercial break they must be reading our comments,H
the fatman should give them a shot at the wc,none
notheism are you serious how can you say this is revenge the rapist was caught in the act i understand your ignorance but for god sakes pick up a dictionary,none
wake up and smell the coffee who is the current premier of the wc,L
interesting story on the canadian prime minister s reaction to a nude painting done of him star art helps to expose the naked truth,none
it puts politics between women and their healthcare what do they think they are doing both sides are putting politics between americans and their liberty as an aside the only reson the left wants people to have all the abortions they want is because they want to control who can and can t have children they want to create the master race themselves women s rights sure like they actually care if they did we d have occupied the middle east a long time ago in the name of saving women from rape mutilation and murder,H
i would fuck that bottom all day and all night that ass is just right and that moaning will just get my dick harder damn,M
been there done that got the shirt posting here is part of the counseling for my parole thanks for caring though,none
who da fuk are you calling adumbas pussy you r probully a negro with big ass lips and a big ass nose,H
lmao oh yeah please tell me how the fuck i would be rigging the polls faggot maybe if your ass was not so dumb youd think of ways to get people to vote your shitty music heres two that have apparently been working make an event on facebook with directions to vote message the online people on facebook and personally tell them to vote come on buddy put your brain to work maybe you can be charlie sheening too smh,none
chavez is for his last dumbass if you think that is hitting better as of late then i totally expect it because you are too stupid to bring anything to the table just go out and play in traffic will ya you are a disgrace to o s fans everywhere,M
why do you white people keep coming here trying to act like they are one of us go burn in the sun i hope they kick all of you pale devils out of africa you fools are going to bring pain on to yourselves you watch we watch in a world of the lost the battle of open minds is becoming a reality,none
are there no periods or commas on your keyboard os is this how you were taught to structure a sentence let me guess you went to public school on the really small bus did not you,none
sholaameobi what planet do you live on you need to get down to specsavers are you blind or stupid,L
aw da poor amber is out of clever retorts so he resorts to year old parrot tactics lol you have now regressed beyond what that year old bully did to you bravo perhaps we can regress you to the point that you spit up on youself like an infant,none
wrong again look it up fool the list of sb winner w hall of fame qbs at the helm is not endless not even close you boob quit talking out of your ass scatterbrain is a good name for you afixing your iq to the end of it is also a nice touch,L
the comments about this sad story only proves how smart some people are in this once great nation kenya is an us ally and have been for years including during w bush s administration if this crash was an act of terror this would not be the first time kenyans faced acts of terror due to their alliance with the us remember the us embassy terror bombings in the late s by the way kenya is christian and the people are not starving to death for those who somehow believe kenyans are all terrorist trying to destroy america because obama s father was kenyan get an education before posting smart comments about a nation you smart posters obviously know nothing about my heart goes out to the good people of kenya during this tragic event,none
expect the two technicals those are all legit foul calls you guys are just being bias,none
you lack empathy is a fucking great drink,none
i feel like shotime looked inside my dreams and just picked a bunch of random shit out of it to make a show sheen caplan sex period pieces retro science and sex,H
stick it up your ass faggot you get another flag,none
are you living in the s when the usa had the bomb and no one else or are you living in the s and the bay of pigs where were you in the s remember iraq and weapons of mass destruction ten years later and the result inflated size of government homeland security lost freedoms patriot act ballooned deficit cost of war borrowed from china and that does not account for the blood shed and loss of our children time to turn iran into a giant glass bowl i am not willing to expand the size of government lose more freedoms increase the deficit borrow from china or shed anymore blood for someone living in a time warp or israel who is itching for a fight if israel wants to blow up iran that is their business but this is not the usa s fight,none
what the fuck does this sentence mean,none
a frank yesterday a frank today a frank tomorrow i have been and always will be one big frank,M
that takes more strength than the father in the story would ever know much respect to you,none
i love cam newton s upside and think he will be an all pro caliber qb but td s and interceptions and nfl network has him as the th best heisman winner to play in the nfl tebow was also on that list espn had a problem with tebow but never mentioned how stupid it was that a guy who had a decent year throwing the ball for a bad team is suddenly on a list that tim brown is not on i am so tired of espn hyping things up and blowing them way out of proportion for better or worse,none
really and you will get an honest opinion on the injury you received stopping that mugger it must have been painful falling on that exact same spot when you went tubing but i am sure you shrugged it off like the hero you are,none
screw you not all inspirits are like that destroy us please you wish inspirits are powerful stop underestimating infinite s popularity,none
bullchit using a scat phrase in your chittyhonor obama and his handlers namely axelrod have incorporated bin lladen as a mythological enhancement to your communist hero s fading image your are not only full of it unhinged and repulsive you are a liar,none
you are a pussy ass punk,none
how the fuck do you have orange beef but not orange chicken,H
bient t mieux david,none
i am an election official and was running the polls here in southern california last tuesday one libertarian voted,L
yeah rising prices and cut food stamps before you tax the rich now that is fucking rich what they give a family now does not feed them for a month and the families need to use the food banks to supplement,M
sorry i hate to be one of those people if they exist here haha but i posted this juts a few minutes ago in the old thread and i wanted to move it over here because it s a bit mind blowing from her letter to tiger woods the world seems to be all up in your business and i m sorry about that i really am what happens in your life in your car and in your marriage should not be a public issue unfortunately because you are a public figure sometimes your private life does become public i guess it comes with the territory and maybe you re used to it by now it still must bite though of course i long for you to own your mistakes tiger if you aren t already and i hope you are man up to the pain you caused your wife and family let the hot searing anger she has for what you did change you not harden you it must be a hard road to walk both for her dealing with what you have done and for you making sense of where to go from here when you are in the public eye the way you are stand behind your actions by way of fully admitting and acknowledging them to yourself don t lie to yourself or pretend they aren t as bad as others think or that somehow you were justified you weren t you are reaping what you sowed tiger own it but see whether you acknowledge all that publicly to your fans is entirely up to you it makes no difference to me if your public apologies are detailed or not for it is not us you need to be apologizing to because you are well known does not make you accountable to the public share only what you want and keep the rest private keep it all private if you can but and i speak from painful experience here coming entirely clean does feel good really good tonight i am praying for restoration for your marriage having almost lost mine because of my own sin and pride as well as that of my husband i now hold redemption in marriage in such high regard but my advice as someone who has been there don t hide it own it embrace it learn from it change your ways feel repentance apologize to your wife seek counseling lots of it if you can let the searing pain and guilt and remorse you hopefully feel inspire in you to see yourself for what you are a wretched sinner in need of forgiveness you your heart and that of your wife and children are what matter focus on them on saving your marriage if that is what you want to do and truly my husband and i pray that it is what you want to do,L
riddell is just parroting the brown s own propaganda about being a politician of substance over style when he actually has neither do we remember brown s moral compass shame about all the overweening ambition and bullying though and that the clunking fist of mr prudent the iron chancellor had effectively ended boom and bust for us all or had it the telegraph is disgracing itself by publishing this abysmal journalist with her badly thought through and uninteresting nonsense,none
this is a scam and the loser that made the video was caught masturbating in public you are all so stupid,none
me and mine are just back up singers here part of the joe my god choir and i say yes to everything mr beeblmeyer stated above and to the critic of joe jervis i say horsepiss news is danews and ya print the truth that is the whole fucking point well done joe,none
lol and he told them to go suck your man child messiah s big toe lol,none
he couldnt see that his shoes were tied because his eyes were tearing,none
you are absolutely right,H
totes,none
like i said i liked the video not the song obviously your mama is a dumb old bitch she did not teach you the first amendment roman darling soft ass nigga hahah,none
worked six christmas days in a row for the overtime,none
you obviously have no clue who ronald reagan was you pathetic ignorant puke,H
o the man was a genius,none
if you give me your email i will email it to you if you do not have it on your idevice,none
god get rid of the shitty tattoos and piercings another decent girl ruined and she is not even from la and got it tatted lol what a fuckin loser,L
any chance they served deep fried anything on a stick at this event,none
cant belive what iam reading this libatard belives that jimmy carter was a good pres what a looser dont worry odumbo will blow jimmy out of the water for worst president ever,none
you mean something like the romney bus beeping outside of obama speech,none
jackson and westbrook together worked well i thought funny cause maynor and westbrook never worked all that well in the few minutes weve seen it,M
obammy just take moochelle and go away,none
thats is complete bullshit because black people arent the only people that can have soul you sound ignorant as shit whites struggle to im black i have many of white friends thjat had it rough growing up so if you really belive that white cant relate c mon now,none
they should put all the gay and lesbians on an island oh wait there is manhattan,L
your wife is a loon mick wont give her the attention she wants so she kicks off a bit like a a child who doesnt get their own way she likes to be the centre of attraction grow up,none
the fact that he was picked in the th round should have no bearing on the decision he was stuck behind jamarcus russell for three years and his stock drop was strange to say the least irrelevant through you have to look at the fact that he worked with one of the game s best qbs and best qb coaches for years not to mention that philbin knows how to make him succeed,none
tampa is loosing also they may give us yet another break,none
hmm je eli teledysk do fuck it wyjdzie najp niej w lipcu to ten manager jest mistrzem,none
i would include wars as shit on my face,none
for some reason u sound retarded lol damn where u been negro,none
in fact the stranges thing about the pc crowd is the way some of them obsessively abuse me as being autistic or at least suffering from asperger s though admittedly some of them take it obsessive extremes i wonder if the end justifies the means perhaps mrs clark would honour me with another of her odd replies and share her views on such attacks with us,none
fake pic u hoe ass nigga,none
once does not make a campaign children should be off limits irrespective of age if they themselves do not insert themselves into the political process think privacy,none
you have got to be fucking kidding me lmfao you have got to be the most naive fan or you are just a troll i am assuming you are just a troll not all of your oppars and unnirs are virgins sweetie this is the st century it is rare for anyone to wait until marriage even in korea,none
this guy is awesome saw him interviewed on democracynow a month or back good on him a true american,H
lol they will find a way to lose,none
still here you love getting smacked around huh you just keep coming back for more,M
i hope we do not get a season three ratings were down again,M
this munro fellow seems to be an amateur working for an amateur website founded by that privileged and pampered amateur fucker carlson,M
maybe they will change it tomorrow i thought they might do it tonight but i guess not,L
um little fugitive traitor your holes are showing,none
you with the racist screen name you are a pieceofshit,H
have any of yours stopped ogling each other long enough to evolve past monosyllables and cute attempts to use vocabulary you do not understand,M
i bet you are a white devil or cracker,none
k k k or nazi i cannot tell which disease you suffer from could you please blog some more,none
i think she is an idiot all he does is cheat on her come on vanessa you are gorgeous and you certainly can do much better,none
i guess because it is taking the lord s name in vain which is offensive to christians whatever fuck the internet it is getting too pc d,L
so not focusing on boston vs miami for a minute who is the scarier opponent sanan or okc,H
tabby jhay cutch el toro pgh kid gfj hit collector cb ground chuck,none
i am a butch woman will not you come try and whoop my ass you weak ass sniffling little troll in fact better yet bring your wife along she s almost hot and i am sure she would hightail it away from you boy,L
were you born stupid or did you have to work at it,none
probably it is memorial day after all a good joke on barajas part and a sign of a wounded vet,none
the u s govermet spends billions of dollars every year guarding against al qaeda,none
you are a child rapist in ny you have admitted it many times you sick fuck you have no room to talk,none
your are an idiot,L
obviously you are a deeply sad twisted and debauched indivudal whom if i were to meet i would take great pleasure in tearing the face clean off why do not you top yourself and o the world a favour no doubt after you have had one final masturbation anout jon venables you little maggot,none
the fa need to look closely at the vt its a game ban balotellis nothing but trouble,none
hey lawmanjed do not let the trolls get to you they get off on being intentionally irrational because they know that you expect them to be rational just step over them,none
the existence of the interstate highway system hardly outweighs the vast amount of other problems with the federal government i hear a lot of you can thank bush and cheney from you but what has your precious obama done to reverse any of that oh do i hear the letters ndaa i think i do obama is as much a globalist stooge as those two are the borders are indeed open and if the federal government could accomplish it politically and they will not stop trying they indeed would not be illegal aliens you think you are being funny about the violent savages comment but what good will come of importing masses of somalians mexicans muslims and haitians do us these people as a general rule are violent and backwards i see no need for the existence of ms in our nation you seem to think that i support bush cheney or romney nothing could be further from the truth these people are all globalist zionist scum like your much favored obama why is it that it is so hard to see what is right in front of your face obama is a sellout to the transnational elites just like bush is their intention is to destroy us and you seem to have your head in the sand,none
and who protects us from you when you decide you do not like our political views or our religion or the color of our skin and how is asking for some reasonable safety precautions taking away your rights,none
who fuck drew dat oh wait haha,none
you are part of the problem based on your reply talk a long walk of a short and very high pier at low tide paulbot,none
he is never looked into mckenna s spending spree such as the shiny new storefront offices the ag rents at exorbitant rates from buddy putnam in tacoma this has nothing to do with republican democrat it is all about buddies having each other s back and making well for themselves the definition of corruption and collusion,none
more run support more confidence when pitching better results,H
yup obama change is hard huh you nbever thought that this many americans cared for their country the way they do true americans will never convert to communism punk,none
do not let the door hit you on the way out and i hope your ronald reagan blow ups dolls to well in nepal,none
definitely the number of questions asked drives engagement it is not easy to have what appears to be direct access to one of the world s most famous newspapers plus they ask questions that are extremely relevant to the moment and some of their content is behind a pay wall so this feels like free access,none
you shut your whore mouth you shut it right now you are giving him ideas goddammit,none
so when is crawford coming back i drafted yhat bum,none
nothing has been proven at all just like all those birther lawsuits there is no proof just because a bunch of gullible people believe it does not make it true,none
i do not agree with that either melissa i am born and raised here and i have seen first hand how this department and the judicial system work hand in hand mr small as you so elequently put it is a drug dealer but a majority of the upper class around here are i could name a few but i will not we are profiled because we are not supposed to have nice things or money point blank,none
see reply to above derp and substitute your derpy reply,none
and i thought dem s put up their presidential kneepad after clinton left town guess not so tell us u spit or swallow,none
yes you are,none
i have not seen one shred of evidence that rodgers has ever spoken to fsg harry harris and co on the beat up,none
