i will buy one of these thing today they look so fucking awesome they better not fuck with the version and just keep one,L
fight for money go ahead kill yourselfs all for greed common take decision that is not in accordance with what the supreme court says find some connection by the inec and say to yourself ho is my turn to loot not yours or i kill u bounch of shameless idiots,none
just like the media has ventured to compare manu to kobe but where were you then,L
kennedys where sure man whores,none
wow your just as dumb as look,H
mitt i created jobs mitt i created thousands of jobs mitt i created a net plus in jobs,none
fuck robots,M
joe was cut once steve young was already there we ve got nothing but the possibility of a good nfl qb as the heir apparent two different things i can t speak of gretzky cause i don t know the details,none
thats a pathetic flop fuck you jvg,none
keep telling yourself that you dumb tea maggot the only true racists left are turds like you and your worthless tea maggot friends,none
these are indoors glossy sucks everywhere,none
when you die your hair still grows for a couple of months,M
listen i am anti killing but i am not anti guns i am anti dui but i am not anti cars i am anti dog bites but not dogs i am anti shop lifting but i am not anti merchandise i could go on and on i am anti gay marriage but not anti gays get the picture,none
he was almost hit in the head by the previous pitch he was a little out of place after that pitch imagine getting a curveball towards the head missing you and then on the next pitch is a mph fastball down the middle no way your reaction will be to swing,M
irony is not in most conservative s vocabulary,H
billion well at least we covered the cost of the bonuses if anyone yes anyone including anyone off the dole had invested billion at a modest they would have earned billion now remind me what bob diamond made to justify his million salary our banking system is a ponzi scam,none
the gop just can t help themselves the only way i see them having their nominee elected is focus on the economy i think it s doing better and stats show it is but that s the underbelly of obama instead the gop is focused on a pure candidate and bringing issues such as contraception into the discussion is a dead bang loser for the gop but by all means continue to tell women you know best,none
why should putin deal he just murders those of differing opinion it is good to be the president,none
danco do not be upset about not knowing about wawa they are regional according to one of the posts found mainly in the east pa and nj,none
you are better than that pola,none
lucky you sasha so what is your beef other folks taxes are paying for your ride,none
to all those doom and gloomers the chicken littles who claim the sky is falling and that society is collapsing canada has had gay marriage nationwide for years where is the disaster where is the collapse and the persecution you are shouting about where is it please show us some examples because it is starting to look like your threats and fears and warnings are nothing but hot air,none
yeah they would pick up the trash then go thow it in the yard aroud their trailers,none
cardinals are quite good outside of qb they finished the year i think they are hilariously bad at qb though depends on whether you go there or if you are hosting the rams should improve but to what degree is hard to know and they were terrible last year seattle had the d in the league last year despite a terrible offense they improved on paper if we get mediocre qb play this year you will have a tough game at seattle,none
thank you tania really appreciate your comment and you stopping by will definitely get back to a more regular blogging schedule as soon as my exams are over take care,none
do not be fooled the girl is american van jones is an avowed communist and the other white guy following him up is an idiot an unemployed idiot i think,none
he should not have sign the contract requiring him like others to sing the national anthem in the first place,M
ass fps aflack or hijack is that you,L
hahahahaha you cannot handle the fact that i know you are a fraud,none
unless your name is actually shatner your comment is pretty ironic,M
again why am i bothering i m not just suggesting i am stating as fact that all these incoherent hypotheses are both illogical and irrelevant if travyon had been found on his back with his arms spread wide would that have indicated tampering i have no clue what trayvon did in his last seconds of life we know he was shot from between and inches in the chest which is consistent with zimmerman s story trayvon had at least a few seconds of life after he was shot and who knows what his reaction was judging from how his body was found he crawled off zimmerman and died you do not have to roll someone over to check their pulse at the neck i m not quite able to figure out just what you are suggesting but his position at death is irrelevant,none
yep people can be pretty dumb exemplified by your argument,none
moronic statement pea brain there is no pledge to be respectful to the commander in chief i was still in am retired when that trash just about starved us out of the military that was after voting for him clueless libtard,M
wow vicky you finally got one right now you only need about more to get out of the hole but you will need to make sure you adhere to the definition of an opponent if you compare the two definitions that of an opponent as compared to the definition of an enemy you seem to be better classified into the category enemy by the rote definition,H
holy shit son is droppin science,H
doughty should just be called the towel cuz i was think i have to clean something when i hear his name,none
ya and feed him more chocolate,L
i bet the songs on the upcoming cd were written for this twit the message was she is a progressive she knows where her bread is buttered i have never even heard of her i bet if she had to write her own material ms hoe would be a major disappointment to her idiotic fans what was her message with the exorcism cbs management look like total knuckleheads no wonder their ratings suck bring back garage bands they play instruments write their own material perform to their fans most of the music truly sucks today record executives do not even try to find pure raw talent it seems they try to clone their stars visual imagery for shock value over solid rock n roll,none
they would be cuter if the salt pepper sprinkled out of the holes in their necks,none
sadly the catholic church has many criminal molesters most of whom are homosexuals,none
good riddance you drug abusing loser,none
what you are jussi is a plain old fashioned idiot i am no fan of the usa any more than i am a fan of airchair bigot warriors like yourself i am talking about the politics inherent in warfare and made a comment as to why hamas chooses now to accept responsibility openly you fool this is the area i am trained in political science not superstition and religiously motivated jargon like you,none
oh my they blow up so fast,H
bet tim cook just shit his pants,none
in thailand the iranian blew his own legs off but did not harm any israelis is this an example of iran s military might in the end the iranians will blow the legs out from under their own country,none
mary i appreciate your manners and encouraging your classmates to follow i also think it s important for professors to realize that students often have back to back classes i certainly know what it s like to get on a roll and want to finish whatever i m lecturing about however i m also unforgiving when students are late to my classes when i wrote about things professors do that irritate students professors do that irritate students keeping students late was one of the main things students mentioned quite simply one professor s self importance often leads to students being penalized in other classes i would hope that when i go over in class a student would respectfully make me aware of the time thanks for your perspective kenna,none
video breitbart vs cenk uygar over rape at occupy camps posted at pm on february by allahpundit via breitbart tv i should have guessed that eventually we d be arguing over whether occupy has a problem with crime notwithstanding the long long long long long list of alleged criminal activities at the encampaments remember things at zuccotti park got so bad that a women only tent was set up so that there d be strength in numbers against sexual predators some feminist sites criticized occupy for its rape problem back during the movement s brief heyday even huffpo reported on multiple incidents of assault drug dealing and drug use rape and attempted rape according to conversations with numerous protesters per breitbart in the clip that detail apparently didn t make it into their book and of course we only know about some of what went on at least one occupy camp reminded victims that we do not encourage the involvement of the police in our community and a new york city cop told big journalism s joel pollak that there are many incidents of sexual touching and groping that goes unreported to us mainly because the alleged victim is either too stoned or high to properly id them or they dont want to get the guy in trouble some national media outlets reported on the attacks too this is why of course breitbart was yelling at the occupiers outside cpac to stop raping people but now that the movement is gearing up for a big spring comeback i guess it s time for the left s whitewash to being in earnest it s a nice bookend to their demagoguery over the tucson shooting in that case tea partiers were blamed for a crime that no tea partier committed whereas here no occupiers are blamed for a crime that quite a few occupiers allegedly committed fourteen minutes but well worth it video breitbart vs cenk uygar over rape at occupy camps,M
once again i give a tip of the fuckyou hat to faux news so we can comment only on articles that you see to be appropriate,none
i guess this is obama s version of i like firing people,none
you are one of my favorite commenters,none
hahaha wtf jesus christ you retard do not embarrass yourself on the internet,L
and you are the winner of this eli s discussion you got it right on the money tokyo,none
im talking present you moron lol,none
i bet you will find that the free syrian army is killing women and children too you are a fool if you do not understand this about these terrorists,none
i would slap you silly but clearly you are already there,none
quit fucking with my trolling douche,L
until medical staff are held accountable in a court of law mistakes like this are always gonna happen nhs trusts dont care about fines as it is ony tax payers money and not there own,none
you troll so hard,L
thank you aguycommenting for your kind response,none
not as dumb as a thug that thinks it is a bear,none
i guess you are those who have a fetish for huge silicon boobs,none
i have to give it to young blood he speaks the truth but jokers still be eating the puss while it is stink we do not give a fuck we just want to wild out and be animals for an hour,none
guess what op i am a real girl that likes wearing make up likes wearing my hair down likes being dressed nice and sucks at call of duty my strategy is to spin in a circle and shoot everywhere shoot those motherfuckers what now,none
talking crap on an anonymous board your family must be so proud,L
that is because you posted all lies and bullshyt,none
i remember taking a speech class in college and the instructor demonstrated why you need to have your speech in a binder by showing a video tape yes a tape reagan was still in office of reagan giving a speech on an airport tarmac ron started out reading his index cards and doing just fine then a big gust of wind blows all the cards out of his hands reagan stands there says um uh um uh several times and is unable to continue how i wish that was on youtube,none
taxing people at different levels is not redistribution of wealth you fucking retard that is like saying a fat person is redistributing fat by eating more,H
i have no fucking problem tell a dumbacking day to rant about how stupid your ass is,none
god you are tiresome get a life you loser,none
house of bribe takers so faruok with all your noise you are not better than hembe house shame house of rogues house of robbers obj called you people robbers one idiot called hon galambi was abused obj these reps have no shame like a prostitute we should discard this report and start the investigation all over by ngos the only thing these reps do with the probes and oversight function is to further the nest of corruption,none
zuckerberg is jewish you know,none
welcome to the crowd fellow idiot,none
yeah definitely not a fan of last year when we had like separate snowstorms with ft of snow plus like the other snowstorms we had i love snow except when i have to shovel it and drive in it,none
fuck toi ouai arr t de rager,none
thank you for your thoughtful and informative post lisa you covered the pros and cons of public opinion and didn t shy away from stating your own kudos i feel it s your duty to say where you stand in full transparency and to balance the press that sgk is getting for the opposite reason if both opinions are not provided then only one opinion will be weighed readers deserve both the difference is that you stood for yourself not for elisa or jory sgk leaders weren t so transparent they instead used the entire organization to front their personal mission our online voice votes carry far more weight than the political elections once women understand that they ll understand their responsibility to say what they think often loudly and with civility i am very dismayed by sgk s stand because it is playing to politics and not helping women i will not be supporting sgk any longer there are many places that are more focused in their mission to help all women planned parenthood is one of them when i was a starving college student pp was my primary health screener later i did volunteer work at pp to pay back for my healthcare one of the things we were trained on was how to check yourself for lumps and why it was important they have been consistent in their mission to help all women stay alive and healthy often during the most dire of times,none
tranquilo solo a los que usen dolares,none
that s about how long it took me it all works fine like the install but i m having trouble with having siri work after i say hi siri,none
i have a job to do to defend the right of the legitimate voters we have been asking the dhs for months for their database and they have not given it to us so this afternoon we will be filing a lawsuit against the dhs for that database we want to have fair honest in our state and we have been put in a position that we have to sue the federal government to get this information in other words the dhs has failed to identify and remove ineligible voters from florida s voter rolls scott will purge all voter rolls regardless a tea party favorite scott has set a states rights pushback against the corrupt reelected obamadinajad machine obamadinajad has abused the rights with all his federal agencies time to unplug this three ring circus and put some adults in charge for a change,none
fuck the kid lets get the narrator from bastion also he narrates the movie,L
i would actually have a hard time giving up hardy by himself for upton unless i really needed speed,M
that is funny do not care who ya are,none
he must have been flying by the old adage grass on the field play ball,none
assuming something only makes an ass out of u me watch complete video people who annoy you,none
obama s answer to everything is raise taxes more money for him to blow on give aways and flush down his green toilet there is not enough money in the world to satisfy this spendthrift,none
in my area the scrap men and women are around everyday sometimes one in the morning and a different one in the afternoon that includes weekends if you leave anything on the path it goes i left a spin dryer for my cousin to pick up on the driveway when i went to work before he could pick it up the scrap people opened my gates and took it,none
have your eyes examined cause you are blind,H
you know it would be so much easier for all of these socialistic commi pinko pukes to jump on a plane and leave the u s than to try and convert us to their sick ass ideas on how this country should be run,L
a pic from queen nicki concert last night now you tell me who the fuck is winning,M
this is a good shirt to wear if you want the shit kicked out of you while bleeding from every orifice and sporting an atomic wedgie,none
strongly agreed they are born and destined to killed with d support of their imam their leaders they are blood suckers their th generation will never no peace group of beggars,none
the guy is an idiot if he sticks his dick around without protection,L
fucking hot man jeez we look alike love the fur just wish you would share a pic of your dick,M
footlongs next favorite holiday is christmas he dresses up as santa and gets children to sit in his lap all day long,none
may you and your children get the same deserved treatment and end up rotting in the ground,none
why did not obama go to wisconsin and urge the republicans to abandon their own america form of austerity,none
you are about as useful as a used tampon but not as smart,M
hatethehype you are an idiot neil was joking,L
are you retarded the family are suing hustler because they did not want those pictures published try reading the story properly before accusing a family of cashing in on their dead relative,none
by you extreme reaction to this issue it is quite clear that the gay community does scare the h ll out of you why is that,none
pelton v hollinger i m interested in pelton s take on whether or not the storm should tank,none
campbell i urge you to stop cutting one little relapse does not mean that you failed put the razors in the trash and haul the trash out to the curb until it gets picked up you are better than that please get the support you need and deserve from ct or whoever you are comfortable with and know that you have support here and are welcome to email me privately any time if you want to discuss things less publicly get healthy and then get out of the house to do something that is productive so that you will feel better and have more self worth whether that is looking for another job walking the dogs going to lunch with someone or volunteering getting out and doing something is a great way to free your mind in a healthy way,L
he has already done this over times to over people wheelman each and every time it is both illegal and against the site s terms and conditions this site does not exist as his toilet bowl,none
sounds like you are a scummy family,none
haha tranny come harder next time cuz you mad lame fuck outta here with you are ugly ass,none
i love your new attitude and you are so right we need to put ourselves and our health first just like we do with our children so proud of you,none
you see you are stupid you ll probably get shot next week or overdose like a dumb fat lipped monkey how sad that i come from the philippines and i am smarter than your ape ass you people were much more useful as slaves,none
i wish you had called in and dropped this knowledge bomb on them they would not have known what to do with themselves,H
no doubt the poor woman will be offered a good deal on a car when she turns up at the garage,none
i find it funny how some fans are more worried about whose better or how many albums they sell instead of just enjoying the music some fans need to get their priorities straight,none
i admit i like that freaky shit she talks about i fucking love it but it is hard to get pass that face though,none
oh great they are gonna devote time to santino and dbl r ffuu,none
being as you did not attend any school i can only repeat what justasking told you don t get mad as us when your ignorance is pointed out we did not make you babble like that,M
its a good thing the republicans are licking obama s feet,none
commenter your very childish grow up and be a man stupid remarks like yours just proves that you are a little boy and have yet to understand what it means to be an adult,L
video s the shit who you think you are albert einstein love it,none
ha i am glad you are pena s girl you know he really wants to play for the red sox he is from boston and went to northeastern but got cut by the sox and he is terrible haha you have zero valid points,none
as a woman what is it like to be as a woman or a french or greek woman or whatever you are what nonsense meanwhile the muslims rape your continent,none
tv we are so short staffed we have tons of stuff in our group right now that only one person can do unfortunately but this pisses me off because this was data i processed it was circulated ages ago and she should have been looking at it then not waiting until the last fucking minute before it goes out to find issues and calling the boss instead of sending out an email so everybody could have a clue what was going on well the boss is going to hear about it when she gets back this particular person always tries to pull shit when the boss is away,none
yes my filthy little lefty troll both you and barry have just proven my point,M
you are a liar,M
first of all its the scotus moron and secondly the ruling by the th is written for kennedy bro have you read it it mirrors romer v evans i wouldn t be so sure about your slap down we only need one vote from the supremes and judging by their rulings on gay rights and equal protection in the past perry v brown is a slam dunk for our side,none
fucking sum rich bits should get death sentence because if she did that for yrs she probably violated a child hope not but die bitch,none
your ws a fluke,none
bama in o inherit the wind bama in o they d abs lutely n thing delusi nal angry selfish lying stingy c rrupt greedy crooked c mmunist republicans all have committed p litical suicide o the unre electable bigtime lazy whiningass crybaby pathetic loser demon the pacifier sucka b ehner damn rite lugar is definitely out you are next the unm tivated unre electable well kn wn super dastardly weakminded s rryass quitter loser demon eric the cowardly weasel cant r damn rite lugar is definitely out you are next the ld dumbass loser demon its definitely time retire mitch the bigg time evil snitch mcc nnell damn rite lugar is definitely out you are next inherit the wind you are most definitely g ing b w d wn believe y ur bstructionism d abs lutely n thing final days ar e most definitely numbered it is permanently engraved in st ne damn rite president obama a man f all the pe ple in o forward give moe powwa da peeps,none
now just tell us what time and place the president will allow questions since he refuses now most of the time to be answerable to anyone and just what is the right time time to ask why he is breaking the law and doing what he said he couldn t,none
fuck yeah the killing is over,M
i personally like d,M
you either know that is a lie or you have not checked,none
my favorite part was show killing vince with a shot of air,none
the greatest generation that won world war ii and saved our nation and the world from hitler are the old white men and women,L
obama does not care about latinos just their votes,none
do your homework before you talk shit faggot,L
you seem racist you dumb ho why not start crying about slavery even though you were never there i am irish my ancestors were slaves too do you hear irish whitey crying for a handout i am not afraid of black people in fact i never met a nigg r that i could not beat up and stop being afraid of whitey s sexu l prowess you black girls love white men and you know it maybe because we raise our own children something nigg s been dodging since the day he was born or maybe you are afraid of our intelligence and education afraid of black people lololololololololololololololololo anyway back to the slavery issue we bought you and your nig ets from other black peeps which means that you were sold to us by black people so get mad at them not us they sold out they own race bit h now bl w me you stupid nig a ho since that is all your mouth is good for b,L
hey my team is games under and my fans think were the best team what team am i,none
jerome the fruit the worlds still is not going to accept you and your sodomite father doing each other to unconsciousness get over it,M
being cocky is good as ever ahahah xd,L
damn it nicole fuck it up for us just once please,L
janab haroon sahib imran khan ko lower middle class ka likh kar aap nay apnay ghubbaray say hawa nikal dee bhai itna favoratism acha nahin hay you will lose respect of your readers,none
so the pools are not open sundays the hell are my taxes paying for,M
yes you are right cbi congress bachao institution,L
great attempt at coaching by okc the slowed the game down if was another team they may have collapsed under the stress but the bench is soo deep all new heat fans watch how the spurs played team defense and collapsed the middle scary,none
i am sure dumb asses like yourself will be trolling full force under our next president romney what does boyhollow mean or do we want to know,H
smacked by who you coonass boys sure are corny,H
i m not sure their is a prototype build for the rush olb in grantham s scheme it is basically whoever can get to the qb best i think jenkins definitely projects outside as well as floyd jhc could definitely play outside but i think he is the only one in this class who could also lock down the inside as well,M
bitch please you are the biggest troll p,none
a brony deal wait damn,none
mm hmm thweety whatever princess progressive,none
jesus just told me you are probably gay and love come more than this priest,none
