i am so tired of some people cramming their religion into other people s faces and being so noisy about it i thought you were supposed to pray in closets the first commandment should have been do not be a dick,L
you can take international law and shove it you are such a schmuck i don t know why i even comment on your idiotic posts the peace activists on the ship started hitting the soldiers with weapons in order to kill the,none
when lebron wins one your become a lebron fan,M
this place will become another millenium dome spurs are not a big enough club for this sort of stadium its got failure as a football stadium and thus becomes a concert arena to pay the bills written all over it and the funny thing is who the hell will travel to tottenham for a concert there will be a big white elephant in tottenham to replace the rusty chicken hahahahahaha,none
a funny thing happened on the way to that forum but all the optimists were too happy to notice,none
bitch you digraced the whole nation now wait for the whole pakistan to bombard you with their precious comments fuckin fraud,none
grazie mille sabrina sei cos dolce baci,M
the idea that chappelle in whiteface is potentially as offensive as ted dansen in blackface is frankly fucking ridiculous and honestly makes me ashamed to be white that s the best argument for mcgee being the new siims,none
nope it is a moron like you who needs to shut up,none
from your computer through their website,none
cadge me a fin i will pay you back,none
and you are,H
gatta eat cubans not ham no wonder why you are nowhere close to accurate,M
i feel like i raised them and then watched them graduate so proud they had no sones in the audience no fantastic stage no pre interview or fan chants or anything and they rocked it so fucking proud ya ll do not even know and my god that had to be the first time i have watched a full episode of letterman and sweet jesus people watch this where the hell did they pull bill murray s old ass from and regis go rest man you have done so much i know it is hard to turn off of work mode but goodness just go home,M
how do you make a plumber cry you kill his family,none
what i have not seen heard is an effort from komen to get ahead of the issue storm and offer their side of the tale if i was them i would make a greater effort to make their constituents feel like they are being heard deleting valid criticism is not going to work i have never known people to be pacified by being ignored and or told to shut up,L
we afford what we have to afford marco,none
yeah well director interpretation is not always the best insight for things like this especially with something with such a rabid fan base on top of that i think they are condensing more than i would have liked even if the golden age was kinda meh in comparison to the drama going on now i would have at least liked for them to show them doing their thing on the battle field,none
lingering fog has been fucked for over a week bud,none
those trails will definitely get plowed regardless of the investigation they will just see it as easier to plow the area than deal with it and once they got plowed i would never return or risk getting stopped and heavily questioned by the po po s p s all the stupid comments are unnecessary it is really easy to be cold and heartless and act like you do not give a fuck but i would like to see these anonymous commentators talk shit like that in front of this person s family or even their own mother s grow up children and learn some respect,M
fries the prayer breakfast has been going on for years and presidents over the decades have gone to these events,none
very well said and i agree totally,none
bet your glad you did not have the balls to use your real name you look like such a dumb ass now check vigilant bonuses on that link,L
people think the yankees are scary but nothing s as scary as the iraq lobster com watch v aidr zvzso,M
hey that is an insult to my religious beliefs make fun of santa and jesus all you like but hl is prophesied in the sacred valve scrolls,M
is this one of those homo sedin brothers henrik im guessing,none
may he eat shit and live,L
you are such an incredibly ignorant piece of,none
are you talking about the conservatives that cheered the idea of letting a man d ie if he didnt have insurance or the conservatives that booed a gay soldier currently deployed,none
well it will be hard for iran to claim israel is responsible for one of these attacks the purpetrator blow himself up and was cooperative enough to bring his passport to prove he is iranian these countries especially india should rethink their relationship with iran and cooperate with the sanctions buying oil from a state that sponsors terrorism will only lead to more problems for all it does prove to anyone objective person or nation who had any doubts previously that the iranian regime is engaged in lies and deception both in their involvement in terrorism and concerning their nuclear program,none
i think it clearly displays your lack of rational thought if you truly believe that,none
s lo predica el hermano rock you,none
ouch i would not call her a turd jeez i mean she is not a very talented actor or a model but she is not a turd,L
obama what me worry,none
why are you here,L
disqus gunjan di plzz mujh se naaraz mat ho you are angry coz i thought to close my ff di maybe people do not like it aur uss larki ne bhi kuch soch samajh kar hi comment kia hoga that my ff is not good ab plz mujh se gussa mat disqus sadaf di aap bhi mujh se gussa ho plz aap tou gussa mat ho actually di meri koi id nahi hai aur na hi mein fb per hun mein tou comment bhi apni behen ki id se karti hun i do not have an id aur waise aap ka chat box wala idea bura nahi hai,L
los angeles kings new jersey devils goals on the minute powerplay the dumb shit that took the charge may have just caused the devils the cup,M
morons like you do,none
go eat your dog you pos libtard,none
it will not be as dramatic as that i mean we england fans who go to poland have been given the safest guarantee that we will not stay long there anyway after the first round we will all be back to england with our team of heroes who battled and fought but were just unlucky lol,none
how about bring the troops home to their families and stop this farce,none
does anyone think the lib dems will ever own the tax cut for the richest or the granny tax those political party destroyers have george osborne stamped all over them,none
if ya wanna flirt easier to simply call me or come down to visit west palm,none
thank you for your comment sorry to hear about the banking soda let me know how everything is going keep in mind you can post a picture in your comment on here as well if you would like to do that,L
you are right concerning campbell my bad the qb carosel has me mixed up anyways i still do not like knapp and think we went that road with him once before and do not need to revisit it again cable obviously did not think too high of him if he stripped his playcalling duties and decided to call the plays himself if knapp was truely great at what he does he would have had some positive influence on this team with his quarterbacks and in my opinion he didn t carson palmer needs a guy like saunders whose offensive connection to him is undeniable,none
ustaadji you are the greatest,none
everything in your post that i am replying to has nothing to do with what is taking place we have a president who is wiping away all state rights in an effort to control everything via the whitehouse usa does mean the united states of america after all the guy is desperately attempting to even have americans suck it up and betray their core religious belief s because it won t jib with his centralized government ideology i suggest you get over it sir what he is doing is not american in any way shape or form and i don t remember complaining about taxing i have been complaining about the spending your trying to put the cart before the horse not going to fly sir,none
kd come the fuck on you have that jordan s blood come on,none
it is pretty meaningful when it is the highest ranking government official but there is no shortage of additional examples take a normal high school with an approximately white and black student body as an example go look in the lunch room you will see whites and blacks sitting with their own much more often than not most serious conflicts will be divided along racial lines racial preferences are also reflected in where people choose to live there is an affluent black community in my region because affluent blacks often choose to live among other affluent blacks they should not be blamed for it it is natural for people to want to associate with people who are like themselves people s desire to associate with their own kind is not just a national trend it is a characteristic of human nature which has existed for many thousands of years all over the earth,none
yes god gave us free will no matter what the sin is sin is a choice people were not born gay somewhere in their environment or upbringing they chose that lifestyle there are people who enter it and leave it every day,none
are you fucken kidding me,L
and you really believe she paid for that car really damn you dumb lmao,none
that is always an excuse maybe they are not wonderfuls or any other fandom i mean why cannot you accept that in every fandom there are these crazy ones we have seen them here and f x earlier articles and yes they were very rude,none
this was the joint back in the day and am i the only one who thought gregory looked like he could be philip michael thomas brother lol,none
you calling others ignorant assholes hahahah that is a fucking joke,none
so its sad you idiot ray is one of the best pure shooters so dumb,none
fuck you fred,none
god bless you and may you live a long and fruitful life and spread your wisdom,none
the last few weeks seems like a bit of an exaggeration do not you think i have not seen that much shit around here besides angry s latest blog about that guy,L
a mi no me hagas la pelota,none
and cover your wallet,none
get gungnir and growlanser wayfarer of time and you will be touching your psp all summer,none
here he is explaining how they tried to have him killed for propaganda purposes,H
jennifer you need to learn to be by yourself you do not need a man,none
you are a fucking dumb ass go back to you xbox dickhead grow up you little fanboy,none
mcfloyd your simple assertions do not hold up to scrutiny did bush live within his means did he fully reveal the costs of two simultaneous wars energy policy made behind closed doors and led by dick cheyney or the costs of the big pharma drug benefit giveaway did president obama inherit a budget surplus or budget deficit how many jobs were we losing before the president took office when you come back with those answers perhaps i will give your inane little quips some consideration,none
come on sweeney show us again man,none
are you serious,L
evidently your not smart enough to do the same thing or you wouldnt be sitting on your lazy ass dropping spam on this website,none
beautifulflaws okay i am putting my throw back shirt cow girl boots on seriously i am coming,none
that second picture of him is not that appealing but it cancels out with that first picture i still want you in my bed kibum,none
i know thanks for pulling them,none
whichever one you hate the most is the one that is real for you,L
iran has already done it by proxy you have no idea what a brutal regime this is,none
hey teacher deserve every penny they can get it is a thankless job and very important,none
or not nigga put that shit away take your ass home and flush that shit,none
they should be dragged into the dugout and beaten with bats right,none
i love top to death but i get how blue hair s not only his right jokwon looks good with it too but honestly top will forever be the only one in my heart as the blue cotton candy ice cream d,none
double retard for you,none
g d you rally are an idiot the article talks of deportation and you are talking about lynching what next anna is your little mind going to start imagining concentration camps in the negev with mass gas chambers cremetoriums how many sub saharan refugees has your country welcomed,M
definitely it is trumped the burt reynolds episode and i thought that one was quite hilarious since this one had the ocelot ergo latin it was better,none
do not ever say amazaballs ever again,none
weapons lol hes an idiot an waste of human space had it made and ruined it all,M
my daddy says he is pissed because he aint gettin reggies love anymore can someone explain this to me after all i am only years old yeah,none
a simple history based warning for the liberals out there if you will take a little time to review history real history not the revised versions that are and have become so very popular today you will find that gays have been persecuted worldwide ever since the fall of rome the radical elements socialists marxists and communists encourage the gay movement to indirectly help them become more powerful once in control things will change very dramatically as history clearly shows what happened to gays in germany china and russia what is happening right now to gays in the aftermath of the arab spring the so called hate gays say they get from the right will one day seem like a little teasing compared to what waits for them if this republic does not survive we the people are all of us on a very dangerous path the current administration must be defeated at all cost in november our very liberty requires nothing less,none
you are a bleeping idiot,none
if both of you are dirt poor,M
wow you really should not suck your daddy s dick with that mouth,none
you fail miserably in thwarting logic ever hear of the rule of law in your obviously pathetic educational backround idiots like you make blogs fun to laugh at but you have no place in society as anything other than a clown how many commendations from congress or presidential administrations zero who are you and what significance are you to our world i think zero sums it up a big fat waste of resources on an obviously flawed specimen of the human race,none
you clearly do not know him,none
i didn t these replies did not end up together with the original comments,none
i am ashamed to have ever supported this piece of crap at one time he seemed to have good actions for this state and this country but it all went down hill with the anger he held inside if something doesnt change soon we will see alot of this type of death because this country will go to war over the claim of this land many will die and it wont be pretty but this country will be back in the hands of real americans obumbles must go and i blame him for this,L
i also havee an objection to my money being used to offset their pollution fuckwits,L
tell him to hang in there look at brian baker for inspiration,none
lol i usually do not care for their announcers but that was good,none
unlock your cap lock refrain from the vulgar language as it makes you look ignorant yes these gullible naive people go to her they do not know any better we already know this what is your point speak rationally or not at all lay off the energy drinks and the michael jackson music,none
omg now i feel sorry for you that was just pitful enough trying to converse with trailer park formaldehyde damaged brains step outside once and a while people,L
substantiate your slur or should we talk about the bi sek sual in the wh do not you think the name larry sinclair should be included in your internet whispering campaign,H
headlines going to be in a few months mark wright reject back home,L
horizon i know many people feel like this and i will never understand it it is like saying that if your parents rob a store while pushing you in a stroller that when you turned you should be arrested i mean why would not you want this young intelligent people that have grew up here to use there talents here it seems silly to me to waste all that talent i am happy he did what he did everyone is so concerned with right and wrong now but lets be practical it cost money to send all these people back and your sending them back with there american education and talent,none
i wish him well but athletics are tough when you have lost your confidence,none
if the motherfucking communist murderers in media education and unions hush up the fact that soetero dunham is a foriegn saboteur they will certainly not be helpful now jackasses,M
or the alternate address their corporate headquarters lbj freeway suite dallas tx,none
and your point is,none
the less you have the more you understand suck it up and press on the more you have the more you think you need a pill for every discomfort,none
i am assuming he has a mustache as well as the headphones and ipod case it probably would have been more relevent to mention that,none
you are talking apples and oranges,none
your comment exposes you as iliterate and a fool,L
the microphone button wont work,M
you don t,none
you are joking yes,none
shut the fuck up you and the rest of your faggot friends should be burned at the stake,none
hey deniro go fok yourself u wop,none
how is it reasonable anon when harper has done none of the things you attribute to fascism all powerful leader has to stand for re election in three years strict social order you are joking right glorification of militarism the troops have been recalled and their budget trimmed opposition parties hale and hearty and full of piss and vinegar elimination of organized labour no they did that to themselves by pricing themselves out of the market advancement of business over individuals elaborate ethno centrism try qu bec thomas mulcair s home ground disparagement of the constitution that is the scc s specialty belittling the courts who doesn t these days and for good reason dissolution of mp power do you see the house of commons burning along with those crosses in prince george spying on ordinary citizens child pornographers are not ordinary citizens judging by the raving of harper s enemies on these blogs if he wins another majority there is going to be a worldwide tinfoil shortage,H
he is not an isolationist he just does not want a foreign policy that ends in america stomping all over the world like babylonians only ron paul will defend israel when they blow up iran s nuclear sites just like only ron paul defended israel when they blew up iraq s nuclear sites ron paul is hardly an isolationist he just recognizes a lot of tough truths about america s foreign policy that the self righteous warmongers just cannot seem to swallow,L
you are not the world s best debater,none
every team has the ability to beat anybody that is why they are professionals come playoff time that changes,none
your name is not richard its dick see me funny loser now go get a job dumbass no need to reply while mommy is wiping your ass wow this is fun haha,none
president romney sounds really good now cheney for vp and we are all set yeah that is the ticket romney cheney and the motto will be just to piss off the liberals,none
i will like your comment too if it makes you feel better,L
i think the only trickle that effected you was the trickle of sperm your dad gave your mom and most of that trickled down her leg go back to sleep we will wake you when you are needed again,none
be careful what you say your comment has to be approved now by unelected hypocrites in washington,none
you bet just like jimmy carter the pols will not cut their sacred cows so lets cut the military because they can not complain or they will be brought up on charges we live in a dangerous world more so than when it was the cold war we have unstable people around the world that would love to destroy us and blow up themselves all of the technology in the world does not replace boots on the ground in the air or at sea navy vet retired,M
that is a management issue not rank and file employee issue quit crying like a cry baby just because people vote for other political parties than republican,M
do not give up billy you were so close,none
umm the heat run sets on offense what are you talking about they suck donkey balls in the halfcourt when they don t,none
i wish you could smell it just by clicking on it,none
she continues to be obama s whore,L
well stated understand this young folks it is the real deal,none
that guy deserves a fucking medal,none
maybe they will create a black hole that will suck in the entire facility,none
are you sure he is even a real person,none
the russians will agree to a lot of things it is what they do that is important trust me they have no intention of ditching assad,none
what the fuck,L
well no generally if i consider someone a tramp i have no desire to look at their sex pictures what s your excuse,none
are you retarded you think iraq afghan were avenging deaths lol get yourself checked buddy even bush would laugh at you there is a reason why we are proud of india cuz we are not like us or israel who will or can go to war at the drop of a hat on the long run even that is proving costly to them so wake up we are talking about music here not war you dumb moron,L
i was thinking the same thing,none
that i do not doubt as a blackberry clone but your original argument was not that android would have existed just that android somehow predates ios development,none
we shall see only a fool predicts the future you qualify,none
damn you guys woke up baby bron bron and now he choking,none
i think bush was one of the worst precisely because of his amnesty proposals in addition to other betrayals to the conservative cause thanks to him we got obama funny how dems consider him one of the worse when in fact he was a liberal president on domestic issues,H
you may not be a hypocrite but you are an idiot,none
if this message board is so filled with barking and silliness then what by god is someone of your stature doing posting here are you slumming for the lord you are certainly not upholding a position of superior intellect you certainly are not acting like a priest or a saint more like lucifer stirring up the s t a smell that becomes you and your kind,none
y vos ya te hacias cantandole como pedro infante,none
jacc what branch were you in,none
this travis cornell boyce all them nukkas i will never forget nor forgive them for showing their black asses out fuck them today fuck them tomorrow fuck them forever,none
you are an ignorant piece of sh t,none
too thin yes that is what she said while laughing and pointing and then serving me divorce papers mm is about as thin as i think it should be just my preference,none
norway is a proud nation what war crimes did they commit,M
yea because i waste my time documenting your lunacy sorry dikhead we all know you and what you post unlike you we do not suffer from add,L
so the bill bans using aborted fetuses in food what about miscarried fetuses i mean if god kills it then it is o k right,H
could not agree with you more these flowers will be gone in a few weeks however this lad chose to live his life that way and now it has ended and his family and friends have chosen this way to show their grief no most of us law abiding citizens do not agree quite rightly with his choice of profession or the way that it has been shown in his floral arrangements but come on this is his funeral and his family and friends so why cannot they say what they want and do not want even if it is really distasteful,none
that is the quote from konstantin eduardovich tsiolkovsky the father of russian space science you are profoundly learned,L
dude ass den wen he came to wit that lame ass song he was even asser how u get a neptune beat and yo flow all fucked up nowadays i guess ranting on twitter a get niggaz to listen to u but u still want get no buzz cuz u ass den this nigga was on lookin lik hawaiian soffy jay z lik dat one dude said he must not heard ab soul and school boy q cuz they way hotter den him,none
forreal black you are an a hole,none
money diggin bitch she looks like a rat,H
did you ever stop to consider that humans have encroached on a lot of the wildlife s territory,none
the number of invasions your ancestors were subjected to the invaders having their ways with your grandmothers is obvious by your complexion good point,L
i love you not even kidding you just made my life whole again you are a rock star,none
i am sure we would not want this info falling into the wrong hadns and used gainst us so it seems a sensible move to hide the gory details,none
so are you now go to bed boy,none
which second did you buy i might want half of it,none
got a reference for that idiotic comment,none
nope i am fecking huge and i am from leeds also since when was aberdeen in the north of england,none
um i think adele is beautiful her voice and personality in general is prob better than yours a million times how can you even fucking say things like fat people are gross woww discrimination much smh,none
i agree about art of fielding the writing itself leaves a bit to be desired but i did enjoy the book,none
whaa whaa when you lose intellectually you freaks either blame bush or name call newt went in debt a few mill but the god damned comunity organizer sunk us down trillion you dicks are pitiful,L
you are an evil despicable animal and i am sure eventually you will get yours god has a special plan for vile creatures like you,none
you should see it come off automatically in your cart once you go to check out,L
