the m struggles to cope with airport traffic tube connections are not useful for all travellers the infrastructure cannot cope now,none
lol and by the way u seem with ur anime icon ur just another manga fan that cant get pussy so he jerks off with fake titted women lol i purposely commented again just to piss u off now go eat a dick theirs a pimp sumwhere that needs the money from your ass on ur knees,none
how would you prove you are a citizen a birth certificate,M
i still think fabian solutions is an in house creation to provoke more posts i cannot believe any human being even a fifth form leftist could be such a mollusc,M
cause you never know when you are gonna need one lol o,L
lavendar is my favorite color but you can get it in any color to match your room,none
if the directer cast ranbir kapoor for bloody veer then they should change the name from bloody veer to bloody fucker becos ranbir is a bloody fucker yes ranbir kapoor take virgin blood of a virgin girl like a vampire but he always take a virgin girls blood not from her neck but take it by fucking her virgin hole vagina ranbir dhela charecter kapoor simply enjoy fucking virgin hole and enjoy to watch the virgin blood which came out from that virgin hole poor girls so i think bloody fucker is the perfect name for this film if they cast this bloody khandani fucker ranbir kapoor all the best for the film,none
idiotic beyond idiotic actually you must like being a loser,none
il have to pack my things and go dont my me i have been working on my ray charles chops,none
hey queeny if you are litterate which i doubt being into pcp and chit homie read zimmermans police file with the orange county clerk of courts,none
gee whiz ryan is your dik that small maybe you should invest in some of that dik extender instead of a new computer you are nothing but a keyboard warrior,none
magic number magic underpants no big deal,none
point is both are living dead weight and us can find more capable younger leaders because the young have more vision,none
damn speedy recovery paul raining prayers down on you,L
tilley that is because you are not getting enough oxygen she sucked it all out of the room,none
when is bush going to be asked to campaign for romney when he does i will buy you a dinner i wonder why bush is not wanted the better question is why a sitting president like obama is not wanted notice he did fundraisers the weekend before the vote all around wisc never stopped in wisc notice no one wants his help campaigning,L
sorry only got white ghetto in me,L
thanks for confirming that conservative men only see their women as a pair of tits and an azz,H
why is she wearing a sea urchin on her head,M
supposedly a very rare pattern in the c position or sometimes referred to as the bullish doggy style manuever take your pick lol hearted folders default media e f c ba a very suspect though if someone has posted this my apologies i ve not seen it,none
probably one of the few good things this year is humphries production he has stayed at a consistent level from last year and that helps but i do not see him as a starter in a good team a rotation player yes but we should still look to resign him because he wants to be here and that is what we need in a player,L
straight douche wish it was you you worthless racist coward piece of shit,none
seems like you are on tik you moron are all people of your colour rapists of mothers and children i do not think so stop making idiot comments,none
i bet you take monstrous shits,none
lsempa she is not its called ceap popularity if she was in she would be just like m and the others,M
needs to give me a fucking like my biggest problem is licensing i am actually kind of disapointed that the republicans never touched health care when they had the majority i wish they would have taken milton friedman s idea one of the main influences of reaganomics and taken the licensing power away from the american medical association i trust nurses and would have no problem with a nurse treating me rather than going bankrupt seeing a doctor,none
you guys got to stop comparing him to heath if you go into the movie already thinking he will not be better than joker than you are only ruining his performance yourself,L
yes you have been attacked by your biggest prison in the world,M
hating for jealousy is just so absurd though it makes you look like an idiot with no knowledge of baseball at all,none
please use your search engine before you look any dumber or just go straight to the police information so far,none
wow joe now there is an intelligent counter point congrats,none
the korem foundation will never see another dollar from me,none
go get a nice education learn a little about what made america great then get a job and do it well and work your way up some day you will have money too ohh and stop your envious whining,none
its going to be difficult to lose weight in days honestly most of the weight that you will lose is going to be water and maybe a little bit of muscle and fat if you are very careful with your calories you can also be certain that you will gain it back again once you get of the diet i would recommend that to take it slow and easy so you can see the long term benefits i ve personally lost lbs since dec my blood pressure was now its my cholesterol was mg dl now its mg dl i am no longer pre diabetic and i am in the best shape of my life it was not easy but i can say that everyone can do it if they have the right program if you are interested in my story please head over to zdiets net cheers ryan e parker,none
yeah you got your rights but you and your mama will be tossed into frikkinghell because you would rather obey man than god,L
we have a problem using federal troops because of the posse comitatus act united states federal law u s c a bigger problem is that the obama regime does not give a rat s ass about the border,none
yeah i bet you are a occupy fucking nigger,none
sling the term liberal around a little more because people might actually begin to believe you are not a pro life democrat,none
i will be watching you from your closet,H
no you f u c k head,none
bitch fuck a e thug mother fucker im a cold hearted shaolin monk and believe me when i tell you this i will hunt you down,none
not tonight tv chill with that the brewer and dodger fans are just enjoying the game wherever they are hoping that their team wins simple are not it,none
yep and that means that you would have to find another cash cow to suck the teats of nothing but a leach so give it up,none
i too am guilty of over moisturizing my hair its hard to get that balance sometimes i started using protein based conditioners such as aubrey organics gpb weekly and heavy duty protein treatments every weeks and that is been helping a lot,none
you are a child,none
what an incredible accidental tragedy condolences of course and prayers for all,none
i would comment on how confidently the kings are moving the puck around but having a goal lead would tend to instill confidence in your game,L
i agree wholeheartedly with you on ali who i just recently started following on twitter and facebook my problem with walker is his stupid actions are a black eye to everybody who put themselves out for him,none
woman from my avatar should be on number p,none
it does not say in the article if we can bring our own chairs and beverages to the fest does anyone know,none
yaelah cow jaman skrng pamer kekayaan itu jg pnya ortu lo x blagu sombong ga level meningan orng biasa ja tp pnya hasil krja sndiri,none
if only it could be your rectum right,M
is it night time where you live,none
i thought that makeup was suppose to make any bitch look better in her case that is the total opposite,none
he did not say he was freestyling wshh fucked up give that young man his due credit,none
dilfer marino sarcasm alert,none
he won michigan in the primaries holy shit your dumb,none
city were so lucky defoe should have got the winner balotelli should have been off,H
why send when you can set their own off as it sits in pre launch now thats a bang for buck the taxpayers cannot complain about,none
nolimits please consider helping with the president obama campaign we need people like you,none
it is just you smelling your armpits again go back to your nails,H
i just did it but for some reason it is not registering maybe needs some time,none
i suppose the fact that halliburton was the only company qualified does not mean anything to you,none
how can you possibly be such an ass hole all the time jesus this is exhausting people that say they have big dicks generally have small ones hahah believe it or not i defended your bitch ass when you first joined the website pussy,L
what was that like words about nothing you are going after andrea mitchell what was fox infomercial not broadcasting yesterday how about the apologies issued for the epa drones and yet here you are attacking andrea mitchell about some stupid gas station gimmick here s another newsflash for you mr romney r is out of touch we all already know it mr romney s amazement was not just about some gadget at a petrol filling post but that people could actually buy food products there and that they actually eat it this very second mr romney is not even carrying a wallet and it is very likely that he does not even know where it is i am still waiting for someone to ask him the tough campaign trail question of how much does a gallon of milk cost andrea mitchell and gas station food unbelievable,none
if japan can why cannot we,L
no kkonservative sunmedia and fans here are the true racist they are here all day everyday spitting hateful venom i just do the same in reverse if you have a problem with me then say something to them unless you are a kkonservative racist too hmm,none
wow way to tell us how rich you are stupid yuppie,none
how about trying this have your kids come home before am say about pm he is take responsability for your kids,none
well then let private equity funds invest in green energy at least they look at whether the company has a viable chance to succeed and they do not allow political cronyism come into play when they make their decision,none
tell em why you mad lool i have my opinion and you have yours and now sports,none
correction bitch you do not think it is superb because your hating ass does not know talent and again i am still waiting on you to submit a video of you singing where is the youtube link i am sure you will get all kinds of rave reviews lol,none
you guys have an awesome slate of games this year as far as the whole smack talk thing will go aside from the divisional games you get rematches against the giants lions and saints plus the packer niner game that never happened last year,none
city chelsea united arsenal liverpool tottenham newcastle everton fulham,none
the karma and lies are ketching up to him,M
fuck you nsa write it down,none
so we are saying the same thing i am just saying the wealthy can pay taxes and at a higher marginal rate that is all it is redistribution of wealth just as it is redistribution of wealth when you and i pay federal taxes in nh and nh gets less back than its residents pay in taxes whereas poor righwing redneck southerners get more back than they pay in because they are less productive than us and less healthy than us you want a fair tax system try my idea a flat income tax on individuals and corporations no deductions loopholes etc individuals get a generous k personal exemption per taxpayer and k per dependent thats it so fam of both parents work k income exempt k pay on remaining k for a tax bill of or an effective tax rate of so fam of both parents work k income exempt k pay on remaining k for a tax bill of or an effective tax rate of so fam of dad only works m income exempt k pay on remaining k for a tax bill of or an effective tax rate of corporations pay of net operating income they get to exempt only the direct costs of production the best part is this plan is revenue neutral including fica taxes,none
this is someone whose self importance got the best of him if anyone should be fired it would be tate this kind of behavior is inexcusable and unbecoming of a man who holds the futures of many employees in his hand,none
oliver stone s kid or babies daddies uncles brother s cousin is not news who cares what religion he is i would like to be him when is new brothers hears the comment he had not abandoned christianity or when the change his mind about his jewish blood not talking about muslims in general just the ones that blow stuff up,none
i know we were without kadri and frattin etc but norfolk played almost the same amount of games as us they would be just as banged up,none
scusa non ho capito che festa,none
no v etci o ho pozn me vieme e hr len do vlastn ho vrecka,none
i do not think they actually knew it was a girl i do not even think they know he has a team or whatever the fuck you want to call it,L
what is your problem why cannot you just have normal and civil conversations come on please grow up so others can enjoy commenting,none
last summer is ne vs suju right and now this summer again ne vs suju fuck they forgot b st ahahahahah,L
once more we see where the soft immigration policy has let the citizens down i bet they come from a family who have less education than a retarded hampster yet were given a nice new life in britain reap what you sow,L
you mean like that one francour just hit right,H
if these ignorant fcks h te the usa then just leave simple quit harassing american citizens,none
jesus christ powell caleb colin he dylan grey could be a fucking bartender for all we know,M
nikestorw be fuckin up man,none
haney you suck as a painter keep your day job wait you suck at that too,L
willy they look like dogs eating their own poo,none
lol look at the brain tdamage momma drink when she was pregnant,L
romney is the etch a sketch man a term given to him by his own campaign staff beware,L
nonsense taken to a greater level than previosly thought possible,L
do not forget we supplied arms and training to the afgans torturing their soldiers now it has come back around,none
you married the turd and bred with him,none
to anyone bothering to evaluate obama on his words and actions vs having someone else do the evaluation for them he has never been anything but a pragmatic centrist the problem with such a position is that the extreme left will claim a betrayal to an ideology never subscribed to the extreme right has made it crystal clear that not only do they consider liberals sub human criminals but they have no patience for moderates of any stripe and the overwhelming majority of people who are in the middle are not political wonks and do not have the time necessary to try and figure out the truth through all the spin so they are unfortunately left with the impressions of whatever sensationalist press last got their attention,none
i was messing with that girl and you guys all stepped up like its your business lol get a life people it s a forum not real life,none
stupid cuz kara girls always have shorts under skirts or dresses it s ok i cannot see shit anyways still luv her,none
no limits appeal to authority is a classic logical fallacy,M
stfu you ignorant communist puke,H
he can be as stubborn as anyone else with his opinions but the name calling went too far i agree,L
you cannot sing and you cannot pray but you can wahoo it up over gay rape just plain fuck liberals all of them and knock the dog shit out of them first if you are so inclineds,none
because kagawa is not going to sell shirts to their favourite team,none
and you know they have burned holes in all the carpeting,none
because you are doing it wrong you must alway unzip first otherwise the torture never stops,none
sgboy get back to your cot i hear your parents calling for you,none
obama s econimic plan bs,M
is the five shot on location in an old folks home i think they were pretty bang opinion wise but geez coming up next on the five teenagers on skateboards scary or silly but before that we ll remember the good old days by talking about how television in the s was more wholesome than it is today,none
i like you aggie,H
so you are saying is not expensive rich boy logic,none
fucking hotest blowjob ever,M
soon we will all be pledging allegiance to the united states of obama,none
and who are you the proud lord said that i must bow so low only a cat of a different coat that s all the truth i know in a coat of gold or a coat of red a lion still has claws and mine are long and sharp my lord as long and sharp as yours and so he spoke and so he spoke that lord of castamere but now the rains weep o er his hall with no one there to hear yes now the rains weep o er his hall and not a soul to hear edit reply,none
i think the sausage might make all the difference the white peppered gravy sounds fine it is just the idea of pouring it on what appears to be an unsweetened scone and calling it a meal seems strange so you do not have kippers that seems strange i thought that every homestead had a smokehouse and there are herring in the seas anyway i like your scots irish theme there might even be an ulster scot right here on my t,M
powers msnbc is far far more biased and hostile in it is comments than fox at least at fox there are usually opposing views msnbc is just a shill for the president and they keep having to fire their hosts for all the outrageous remarks they make now cnn is getting almost as bad as msnbc,none
sorry but that is just a dumb statement you are comparing some rd party promo to apple s own functionality for example if this were a reference to a carrier removing google navigation and forcing customers to use telenav you would have a valid argument but not in this case if you want to make odd comparisons let us talk about how the iphone fucked everyone on sprint who enjoyed yr contracts longer return periods and other perks that got taken away all because of the iphone see that is why i like android because they do not make the carrier take one up the ass and screw their users out of perks they have enjoyed for years,none
and my dad can beat up your dad,none
look like you had a great weekend lauren,none
proof positive that you are idi t,M
self defense that little girl must pack a mean punch,none
i like him i do not think we can blame him for everything from bird droppings to flat tires,none
i shall give you one reason one reason and you will want to kill for that robocop remake jose fucking padhila,none
pig maher you forgot your meds again you know you are one sick sob so do not forget,M
it is clean it is not shaved right there is all i want if i am eating your pussy my dear it is because i want to smell and taste you,none
you showed your true colors in addition to comment misdirection you are now using name calling and innuendo name calling innuendo comment misdirection the last refuge of someone who has no viable logical or well reasoned comment,none
hey moron william reynolds impeach yourself and then go kiss a muslim like your hero bush,M
is it just me or does anybody out there actually think its better that the heat are being considered the underdogs against whomever they face in the finals it just seems to me like the underdog is facing less pressure granted that lebron always be under pressure and will be criticized if they loose but i just prefer it to last year where it was considered more even,none
hey right winger just thefax immigration is not a wedge issue it is a policy issue get a clue moron,none
wait a republican senator had an affair with a woman i thought those guys just hit on other men in public toilets yeesh go figure,none
if rcae is your premise help us if fear of religion is your premise god helps us all,M
in the recent occupy wall street protests by the left comedienne roseanne barr had this to say about wealthy americans i first would allow the guilty bankers to pay back anything over million in personal wealth because i believe in a maximum wage of million dollars and if they re unable to live on that amount then they should go to the reeducation camps and if that doesn t help then be beheaded,none
amen to that shit preach it,none
so promptly stated that he was going to release his album in the first week of july with or without the assistance of his label regardless of all the promotions and marketing and what not he was going to release his final lp at interscope and he was adamant about it that is about weeks from now in weeks artists almost always have out at least the first two singles of an album and the tracklisting with features and production this mother fucker still does not even have a fucking title an album allegedly due in weeks without a single tracklisting producers album art and a goddamn title fuck these videos if you really care about hip hop and your fans like you claim you do you would focus on your fucking album,H
i like the cover that is a keyboard good idea hopefully it will be better than the nokia windows phone okay but not great,none
yeah but we love a good smack down,none
can i say dick on here your a dick,none
define abortion in objective terms explain the whole process of abortions too me explain what you see in a sonogram of a baby with fingers toes fingerprints eyes a heartbeat and brainwaves explain late term abortions for me where they pull a baby s head out and inject it with saline and then vacuum their brains out pro choicers are cowards at the core how brave of you to lay down your responsibilities for what you did at a nightclub getting drunk and having unprotected sex and then kill your living mistake,none
is anyone else here totally outraged by the nanny state telling us everything we can and can t do besides myself we the taxpaying citizenry actually had to pay these socialist progressive communistic marxist ass wipe idiots to conduct this ridiculous study how about they spend the money more correctly by investigating all of the corrupt and fraudulent voting practices of the demo libu tards,none
everyone has something to deal with some are ugly some are dumb some have crooked teeth some voted for obama,none
it is obvious that american idol has turned into a popularity contest with a huge female viewer base as proof for the past three seasons the cute guy has won over the much more talented female runner up who cares read more here line may html storylink cpy,none
co je to za stupidn ot zka to nen nic lep ho praktick ho aktu ln j ho kritick ho moralizuj c ho atd bernard z moravy,none
roman caught my attention last year at the ims the shame is his bikes get mixed in with a bunch of busa s with extended swing arms and airbrush jobs his level of fab work fit and finish can compete with any other full customs ive seen and deserves the respect of any other bike builders he just choses a differnt canvas,L
flute as fuck,none
okay then use the word i not we that way you are expressing your personal views thanks,H
i have watched the video over and over again and with all the evidence ballotelli did not delibratly stamp on parkers head for a start parker was behind mario when he fell and in doing so knocked ballotelli off balance and tripped over hitting parker in the head that is what the ref saw the rest is history,none
eat a dick you nerdy looking bastard,none
the illegal rats he gave semi amnesty to cannot vote in nov anyway there is not enough of them to make a difference the white vote is the most valuable and important since there is more of it obummer pissed off a lot more whites than appease illegal mexicans,none
do not stand on your porch,M
your buddies repub turd raibox cyndyb nww nav are all having a party with the obama blow up doll you should join in before the kool aid gets warm,none
guess how they got the money to buy such lavish tributes,none
rays lose rays lose baltimore on brink of losing oh ya baby red sox are on edge of a win against verlander,none
read the article find your answers there,none
then it is a duck not a fascist good thing liberals do not hunt or the country would be run by donald duck while conservatives would be served up with gravy and potatoes assuming of course that these hyper urbanized fops did not pull an elmer and wind up shooting their own beaks off,none
your hunch is probably correct,none
really you do a one time k fund raiser and your comparing it to skipit are you really that stupid do the math what a moron your so proud of yourself did they do that yes and they still are adding to it,M
you are a moron truth is beyond your reach,none
well that is how a lot of people are you are just gonna have to deal with those rumors by dispelling them or going about your life do not let these rumors affect you mentally and emotionally,none
you guys probably should not be informing this child about how awesome you think beer is he can discover it on his own when he is legally able to do so,none
it means the world isn t changing it means the world has already changed steven goldstein chairman of the gay rights group garden state equality but right is right and wrong is still wrong,none
the difference between your wife and a rooster holdyourown the rooster says cock a doodle doo your mama says any cock ll do,none
to duxburian well eisenhower and the man behind him is john foster dullus i do not know who the asian man is so what do you have any point to make do you like to play picture i d in all due respect to you duxburian a lot of your posts are puzzling as to what point you are trying make,none
fat lip monkeys get shot and how r u smarter then blacks because u have a rice dick and suck noddles all day dont make u smart,L
fear the cow because he laughs at you,M
again are you against abortions in the case of rape and incest in the case of the mother s health in the case of the fetus not being viable if not how many of those were those sort of cases,L
omg so fucking stoked,none
